<?xml version="1.0" encoding="UTF-8"?>
<!DOCTYPE branches SYSTEM "branches.dtd">
<branches>
    <branch id="B001">
        <name>Bryan's Café - Centro</name>
        <address>Calle Principal 123, Ciudad Centro</address>
        <phone>(01) 1234-5678</phone>
        <hours>Mon-Fri 7:00-20:00, Sat-Sun 8:00-18:00</hours>
        <mapLink>https://maps.google.com/?q=Bryan+Cafe+Centro</mapLink>
    </branch>
    <branch id="B002">
        <name>Bryan's Café - Costa</name>
        <address>Avenida del Mar 456, Zona Costera</address>
        <phone>(01) 8765-4321</phone>
        <hours>Mon-Sun 7:00-22:00</hours>
        <mapLink>https://maps.google.com/?q=Bryan+Cafe+Costa</mapLink>
    </branch>
    <branch id="B003">
        <name>Bryan's Café - Norte</name>
        <address>Boulevard Norte 789, Zona Norte</address>
        <phone>(01) 2468-1357</phone>
        <hours>Mon-Sat 8:00-19:00, Sun Closed</hours>
        <mapLink>https://maps.google.com/?q=Bryan+Cafe+Norte</mapLink>
    </branch>
</branches>
